{
  "schemaVersion": 1,
  "caseId": "car-control",
  "caseVersion": "v6",
  "eventDiscoveryPolicy": {
    "showDirectEventAnswerOnTakeover": false,
    "entrySignals": ["inbox_badge", "stakeholder_message", "report_update", "dashboard_anomaly"],
    "requiredMaterialComposition": {
      "primaryClues": 3,
      "corroboratingClues": 1,
      "dashboardAnomalies": 1
    },
    "materialsStateFactsOnly": true,
    "materialsMustNotReveal": ["risk_category", "correct_tool", "recommended_decision"],
    "trackMaterialViewsForAiReview": true
  },
  "decisionReasoningPolicy": {
    "enabled": false,
    "fields": [],
    "submissionRequirement": "at_least_one_complete_action_chain",
    "autosaveDraft": true
  },
  "aiReviewPolicy": {
    "overallScoreEnabled": false,
    "rankingEnabled": false,
    "levels": ["mature", "developing", "needs_practice"],
    "capabilityDimensions": ["signal_recognition", "risk_and_root_cause_diagnosis", "action_completeness_and_minimality", "timing_and_tradeoff", "communication_and_governance"],
    "requiredSections": ["strengths", "improvements", "mainline_differences", "retry_suggestion", "knowledge_references"],
    "everyFindingRequiresEvidenceReferences": true,
    "mayOverrideRuleEngineOutcome": false,
    "fallbackToRuleReviewWhenUnavailable": true
  },
  "engineSettlementPolicy": {
    "steps": ["validate_submission", "evaluate_required_actions", "apply_completed_action_effects", "apply_harmful_card_effects", "apply_unresolved_issue_degradation", "advance_one_week_and_trigger_scheduled_events", "enforce_hard_gates_and_terminal_rules", "recompute_views_and_document_versions"],
    "conflictPriority": ["safety_red_line", "terminal_failure", "harmful_effect", "missing_action_effect", "completed_action_effect", "scheduled_baseline_effect"],
    "additiveFields": ["incrementalActualCostCny", "incrementalWorkPersonDays", "overtimePersonDays", "blockedPersonDays", "coordinationAndWaitingPersonDays"],
    "forecastCompletionConflictResolution": "latest_unless_approved_recovery_completed",
    "riskConflictResolution": "highest_currently_effective_level",
    "oneTimeCardEffectsApplyOncePerBranch": true,
    "idealOutcomeApplication": "only_when_near_mainline_conditions_fully_satisfied"
  },
  "branchComparisonPolicy": {
    "mainlineTrackStyle": "gray",
    "personalBranchTrackStyle": "distinct_color_per_branch",
    "immutableNodePerRoundSubmission": true,
    "takeoverCreatesForkPoint": true,
    "nodeDetails": ["action_chain", "state_diff", "document_diff"],
    "weeks1To32ComparisonBasis": "same_calendar_week_mainline_snapshot",
    "afterWeek32ComparisonBasis": "mainline_final_week32_snapshot",
    "afterWeek32Label": "主线已完成",
    "comparisonDimensions": ["schedule", "cost", "scope", "quality", "security", "risk", "resource", "stakeholder", "governance_documents"],
    "maximumPersonalBranchesCompared": 3,
    "mergeOrCherryPickEnabled": false,
    "retryFromNodeCreatesNewBranch": true
  },
  "scenarios": [
    {
      "id": "scenario-1",
      "week": 9,
      "title": "试点车主反馈引发的需求变更",
      "initialImpact": {
        "riskTransitions": [{ "riskId": "R01", "fromLifecycleState": "monitoring", "toLifecycleState": "triggered", "controlStatus": "active_uncontrolled", "assessment": { "probability": 3, "impact": 4 } }],
        "requirements": { "newExternalRequirements": 1, "status": "needs_clarification", "linkedToBaseline": false, "linkedToWbs": false, "traceabilityCoverageDeltaPercentagePoints": -2 },
        "scopeBaselineChanged": false,
        "formalChangeRequestsCreated": 0,
        "ccbOpenItemsDelta": 0,
        "stakeholderEffects": [{ "stakeholderId": "pilot_owner_representative", "engagementState": "supportive", "newPendingCommunicationItems": 1 }],
        "performanceChanged": false,
        "forecastCompletionWeek": 32
      },
      "eventMaterials": {
        "primaryClues": [
          {
            "id": "S1-M01",
            "type": "stakeholder_message",
            "senderStakeholderId": "pilot_owner_representative",
            "channel": "pilot_owner_group",
            "subject": "家庭成员临时用车时无法查看车辆状态",
            "facts": ["配偶临时用车时无法查看车辆状态", "希望允许家庭成员共享车辆"]
          },
          {
            "id": "S1-M02",
            "type": "report_update",
            "channel": "prototype_feedback_report",
            "subject": "早期原型体验反馈汇总",
            "facts": ["20名早期体验者中8人提出家庭共享", "部分体验者直接共享主账号", "报告记录了隐私和授权隐患"]
          },
          {
            "id": "S1-M03",
            "type": "stakeholder_message",
            "senderStakeholderId": "product_ba",
            "channel": "project_chat",
            "subject": "是否可以将家庭共享直接加入1.0",
            "facts": ["产品负责人认为该需求有价值", "尚未提供成本、工期或安全影响评估"]
          }
        ],
        "corroboratingClues": [
          {
            "id": "S1-M04",
            "type": "document_diff",
            "documentIds": ["D16", "D21"],
            "subject": "批准范围与新增反馈对照",
            "facts": ["当前批准版本只支持车主本人", "未包含家庭成员、授权层级或共享撤销规则"]
          }
        ],
        "dashboardAnomalies": [
          {
            "id": "S1-M05",
            "widget": "requirement_status",
            "metric": "external_requirements_without_baseline_or_wbs_link",
            "delta": 1,
            "effects": ["requirements_traceability_coverage_slightly_decreases"],
            "displayLabel": "新增1项未关联基线/WBS的外部需求"
          }
        ]
      },
      "necessaryManagementActions": [
        { "id": "S1-A1", "title": "澄清共享需求、使用场景与安全边界", "completedEffect": { "requirementAmbiguity": "clarified", "clarifiedDimensions": ["family_member", "authorization_level", "sharing_revocation"] } },
        { "id": "S1-A2", "title": "对照批准基线并识别范围外变更", "completedEffect": { "scopeClassification": "outside_approved_baseline", "changeDisposition": "undecided" } },
        { "id": "S1-A3", "title": "评估范围、进度、成本、安全、质量和干系人影响", "completedEffect": { "assessedOption": { "option": "include_family_sharing_in_v1_0", "scheduleIncreaseWeeks": 3, "costIncreaseCny": 180000, "additionalSecurityValidationRequired": true }, "isActualProjectImpact": false } },
        { "id": "S1-A4", "title": "形成正式变更请求并提交CCB审查", "prerequisiteActionIds": ["S1-A1", "S1-A2", "S1-A3"], "completedEffect": { "ccbItemCreated": true, "validWhenPrerequisitesComplete": true, "otherwise": "returned_for_more_information" } },
        { "id": "S1-A5", "title": "纳入1.1后续版本并保护1.0试点基线", "prerequisiteActionIds": ["S1-A4"], "completedEffect": { "changeDisposition": "approved_for_v1_1", "v1_0BaselineChanged": false, "unauthorizedScopeExecutionRiskCleared": true } },
        { "id": "S1-A6", "title": "更新关联记录并沟通替代流程与承诺", "completedEffect": { "documentAndCommunicationUpdatesCreated": true, "documentRevisions": ["D03", "D09", "D13", "D30"], "stakeholderTransitions": [{ "stakeholderId": "pilot_owner_representative", "state": "supportive" }], "riskId": "R01", "lifecycleStateWhenAllPriorActionsComplete": "closed", "lifecycleStateOtherwise": "triggered", "controlStatusOtherwise": "active_partially_controlled" } }
      ],
      "requiredObservations": [
        { "source": "document", "id": "D06", "title": "成本估算" },
        { "source": "document", "id": "D14", "title": "项目进度计划" },
        { "source": "document", "id": "D26", "title": "风险登记册" }
      ],
      "idealOutcome": {
        "advanceToWeek": 10,
        "inheritMainlineMetricsWeek": 10,
        "scheduleDelayDays": 0,
        "incrementalDevelopmentCostCny": 0,
        "scope": { "v1_0BaselineChanged": false, "v1_1CandidateAdded": "家庭成员共享车辆" },
        "riskTransitions": [{ "riskId": "R01", "fromLifecycleState": "triggered", "toLifecycleState": "closed", "controlStatus": null, "residual": { "probability": 1, "impact": 2 } }],
        "changeDecision": { "status": "approved_for_later_version", "targetVersion": "1.1" },
        "ccbOpenItems": 0,
        "unauthorizedScopeWorkPersonDays": 0,
        "documentRevisions": ["D03", "D05", "D09", "D13", "D21", "D26", "D30"],
        "unchangedBaselines": ["D16"],
        "stakeholderTransitions": [{ "stakeholderId": "pilot_owner_representative", "state": "supportive" }],
        "scenarioState": "closed",
        "pathClassification": "near_mainline"
      },
      "missingActionConsequences": [
        { "actionId": "S1-A1", "gapCategories": ["evidence", "communication"], "effects": ["requirement_ambiguity_open", "R01_remains_triggered"] },
        { "actionId": "S1-A2", "gapCategories": ["scope_governance"], "effects": ["scope_classification_unclear", "ccb_package_invalid"] },
        { "actionId": "S1-A3", "gapCategories": ["analysis"], "effects": ["ccb_returned", "one_rework_round_required"] },
        { "actionId": "S1-A4", "gapCategories": ["approval"], "effects": ["change_decision_pending", "ccb_item_open"] },
        { "actionId": "S1-A5", "gapCategories": ["execution_decision"], "effects": ["v1_0_v1_1_boundary_open", "scope_conflict_forecast"] },
        { "actionId": "S1-A6", "gapCategories": ["documentation", "communication"], "effects": ["risk_reduced_not_closed", "pilot_engagement_gap_open"] }
      ],
      "incompleteOutcomePolicy": {
        "scenarioRemainsOpen": true,
        "minimumAdditionalRounds": 1,
        "earliestNearMainlineReturnWeek": 11
      },
      "unresolvedIssueDegradation": {
        "perOpenRound": { "managementWorkPersonDays": 2, "incrementalActualCostCny": 3300, "newOverdueCommunicationItems": 1, "traceabilityCoverageDeltaPercentagePoints": -1 },
        "floors": { "requirementsTraceabilityCoveragePercent": 90 },
        "weekThresholds": [
          { "week": 11, "effects": { "stakeholderTransition": { "stakeholderId": "pilot_owner_representative", "to": "neutral" }, "forecastCompletionWeek": 33 } },
          { "week": 12, "effects": { "forecastCompletionWeek": 34, "ccbItemStatus": "overdue", "escalatedToStakeholderId": "sponsor" } },
          { "week": 13, "effects": { "terminalCondition": "week_13_without_ccb_decision" } }
        ],
        "stopEffectsForClosedGaps": true,